{
  "$schema": "https://json-schema.org/draft/2020-12/schema",
  "$id": "molgap-trace-manifest-v1",
  "type": "object",
  "required": ["schema", "trajectory_id", "run_id", "contract_ref", "model_identity", "reference_id", "comparison_role", "x_axis", "presentation_semantics_ref", "weight_semantics", "metric_semantics", "evaluation_role_identity", "selection_semantics", "trace_artifact_ref", "terminal_evidence_ref", "comparability_identity", "exposure", "backtest_eligibility"],
  "properties": {
    "trace_artifact_sha256": {"type": "string", "pattern": "^[0-9a-fA-F]{64}$"},
    "schema": {"const": "molgap-trace-manifest-v1"},
    "trajectory_id": {"type": "string", "minLength": 1},
    "run_id": {"type": "string", "minLength": 1},
    "contract_ref": {"type": "string", "minLength": 1},
    "model_identity": {"type": "string", "minLength": 1},
    "reference_id": {"type": ["string", "null"], "minLength": 1},
    "comparison_role": {"enum": ["candidate", "reference"]},
    "x_axis": {"enum": ["optimizer_steps", "presentations", "epochs"]},
    "presentation_semantics_ref": {"type": "string", "minLength": 1},
    "weight_semantics": {"type": "string", "minLength": 1},
    "metric_semantics": {"type": "string", "minLength": 1},
    "evaluation_role_identity": {"type": "string", "minLength": 1},
    "selection_semantics": {"type": "string", "minLength": 1},
    "trace_artifact_ref": {"type": "string", "minLength": 1},
    "terminal_evidence_ref": {"type": "string", "minLength": 1},
    "comparability_identity": {
      "type": "object",
      "required": ["scientific_contract", "dataset_identity", "row_split_identity", "architecture_identity", "optimizer_identity", "lr_schedule_identity", "target_transform_identity", "precision_identity", "ema_semantics", "evaluation_role_identity", "selection_role_identity", "x_axis_semantics", "terminal_endpoint_identity", "matched_architecture_required"]
    },
    "exposure": {
      "type": "object",
      "required": ["optimizer_steps", "sample_presentations"]
    },
    "backtest_eligibility": {"type": "object"},
    "checkpoint_identity": {"type": "string", "minLength": 1},
    "trace_fields": {
      "type": "object",
      "properties": {
        "optimizer_step": {"type": "boolean"},
        "sample_presentations": {"type": "boolean"},
        "epoch_or_pass": {"type": "boolean"},
        "learning_rate": {"type": "boolean"},
        "live_train_metric": {"type": "boolean"},
        "live_dev_metric": {"type": "boolean"},
        "ema_dev_metric": {"type": "boolean"},
        "checkpoint_identity": {"type": "boolean"}
      },
      "required": ["optimizer_step", "sample_presentations", "epoch_or_pass", "learning_rate", "live_train_metric", "live_dev_metric", "ema_dev_metric", "checkpoint_identity"],
      "additionalProperties": false
    }
  },
  "allOf": [{
    "if": {"properties": {"reference_id": {"type": "null"}}, "required": ["reference_id"]},
    "then": {
      "properties": {
        "comparison_role": {"const": "candidate"},
        "backtest_eligibility": {
          "required": ["eligible", "exclusion_reasons"],
          "properties": {
            "eligible": {"const": false},
            "exclusion_reasons": {"type": "array", "minItems": 1, "items": {"type": "string", "pattern": "\\S"}}
          }
        }
      }
    }
  }],
  "additionalProperties": false
}
