{
  "backtest_eligibility": {
    "eligible": false,
    "exclusion_reasons": [
      "closure_synthesized_manifest_not_prelaunch_calibrated",
      "missing_frozen_reference"
    ]
  },
  "comparability_identity": {
    "architecture_identity": "unspecified_in_contract",
    "dataset_identity": "unspecified_in_contract",
    "ema_semantics": "unknown",
    "evaluation_role_identity": "internal_development",
    "lr_schedule_identity": "unspecified_in_contract",
    "matched_architecture_required": false,
    "optimizer_identity": "unspecified_in_contract",
    "precision_identity": "unspecified_in_contract",
    "row_split_identity": "unspecified_in_contract",
    "scientific_contract": "molgap-family-training-recipe-v1",
    "selection_role_identity": "best_development_metric",
    "target_transform_identity": "unspecified_in_contract",
    "terminal_endpoint_identity": "endpoint_117180",
    "x_axis_semantics": "optimizer_steps"
  },
  "comparison_role": "candidate",
  "contract_ref": "experiments/pcqm_k1_initialization_forward_500k/generated/50031a24799aaca0480a2b75fb5f9122ecf76424e01c2a739abd6324aeab0926/pretrained/recipe.json",
  "evaluation_role_identity": "internal_development",
  "exposure": {
    "optimizer_steps": 117180,
    "sample_presentations": 14999040
  },
  "metric_semantics": "Gap MAE in eV",
  "model_identity": "unspecified_in_contract",
  "presentation_semantics_ref": "experiments/pcqm_k1_initialization_forward_500k/generated/50031a24799aaca0480a2b75fb5f9122ecf76424e01c2a739abd6324aeab0926/pretrained/recipe.json",
  "reference_id": "ev-terminal-T-pcqm-k1-init-forward-500k-single-s42-scratch",
  "run_id": "pcqm-k1-init-forward-500k-single-s42:pretrained:downstream",
  "schema": "molgap-trace-manifest-v1",
  "selection_semantics": "best_development_metric",
  "terminal_evidence_ref": "experiments/pcqm_k1_initialization_forward_500k/runs/pcqm-k1-init-forward-500k-single-s42/prospective/pretrained/terminal_staging/v1/41d0fb53e395f963/terminal.json",
  "trace_artifact_ref": "external:///D:/molgap-artifacts/retrieved/pcqm-k1-init-forward-500k/single/v2/experiment/pretrained/canonical_trace.json",
  "trace_artifact_sha256": "07fbde905659b0389f31c54d01c51e48e340d8f60c26fbc6db9abc7cb8587e73",
  "trace_fields": {
    "checkpoint_identity": true,
    "ema_dev_metric": true,
    "epoch_or_pass": true,
    "learning_rate": true,
    "live_dev_metric": true,
    "live_train_metric": true,
    "optimizer_step": true,
    "sample_presentations": true
  },
  "trajectory_id": "T-pcqm-k1-init-forward-500k-single-s42-pretrained",
  "weight_semantics": "ema_and_live",
  "x_axis": "optimizer_steps"
}
