{
  "backtest_eligibility": {
    "eligible": true,
    "exclusion_reasons": []
  },
  "comparability_identity": {
    "architecture_identity": "0b2c6b4798546b9b2c6343255d9c9fb0d3ea5c6e04eae57d36615d735a89232e",
    "dataset_identity": "pcqm4mv2-ogb-fixed-100k-v1@1b0e8fd579ab1cb86c02e833e7ad284b4af7582b059f912a77853fdccf3ede6d",
    "ema_semantics": "ema999-each-step-selection",
    "evaluation_role_identity": "pcqm4mv2-ogb-fixed-100k-v1:internal-development-100000-150000",
    "lr_schedule_identity": "a4d40c75b727150bff6f1a581713dc306ac2491d175f5b54c04e3f5060cb415f",
    "matched_architecture_required": false,
    "optimizer_identity": "6122a1c768b0314d3ad4e69d40de3490279285b54aaa506b3e1041fe57847452",
    "precision_identity": "fp32-no-tf32-deterministic-bs128-drop-last",
    "row_split_identity": "train-0-100000-development-100000-150000@71d240a0a0d93054e9b47b9195d43914d3e6eadb66a4efc5346990db8c610818",
    "scientific_contract": "gptrans-v5-observation-reference-fp32-bs128-60epochs",
    "selection_role_identity": "pcqm4mv2-ogb-fixed-100k-v1:internal-development-100000-150000",
    "target_transform_identity": "472f746908b0f692e720a0b21faf3b8f5d48f90c9551dad11e2dd1db691a2285",
    "terminal_endpoint_identity": "46860-optimizer-steps",
    "x_axis_semantics": "optimizer_steps"
  },
  "comparison_role": "candidate",
  "contract_ref": "experiments/pcqm_gptrans_readout_100k/gpu/degree_node_mean_readout_ema999/contract.json",
  "evaluation_role_identity": "pcqm4mv2-ogb-fixed-100k-v1:internal-development-100000-150000",
  "exposure": {
    "optimizer_steps": 46860,
    "sample_presentations": 5998080
  },
  "metric_semantics": "internal_development_ema_gap_mae_eV",
  "model_identity": "0b2c6b4798546b9b2c6343255d9c9fb0d3ea5c6e04eae57d36615d735a89232e",
  "presentation_semantics_ref": "experiments/pcqm_gptrans_v5_audit_reference/contract.json",
  "reference_id": "pcqm-gptrans-g1-degree-scale-ema999-100k-s42",
  "run_id": "gptrans-g1-readout-dual-s42:degree_node_mean_readout_ema999",
  "schema": "molgap-trace-manifest-v1",
  "selection_semantics": "best_internal_development_ema_over_60_epochs",
  "terminal_evidence_ref": "experiments/pcqm_gptrans_readout_100k/gpu/degree_node_mean_readout_ema999/rml_plan/rml_finalized/v5_evidence.json",
  "trace_artifact_ref": "experiments/pcqm_gptrans_readout_100k/gpu/degree_node_mean_readout_ema999/rml_plan/rml_finalized/trace.json",
  "trace_artifact_sha256": "7a7333f95c3df95cfcf9584cfb779486689811ab3c16f07245d736b5d18c291b",
  "trace_fields": {
    "checkpoint_identity": true,
    "ema_dev_metric": true,
    "epoch_or_pass": true,
    "learning_rate": true,
    "live_dev_metric": true,
    "live_train_metric": true,
    "optimizer_step": true,
    "sample_presentations": true
  },
  "trajectory_id": "TC-gptrans-g1-node-mean-readout-100k-s42",
  "weight_semantics": "ema",
  "x_axis": "optimizer_steps"
}
