{
  "backtest_eligibility": {
    "eligible": false,
    "exclusion_reasons": [
      "canonical_reference_not_replay_enrolled; historical eligibility left unchanged"
    ]
  },
  "comparability_identity": {
    "architecture_identity": "1e7521c568ba13f243a0e9dda438e44c6d113c6853f712aa14d059b70a67e39c",
    "dataset_identity": "pcqm4mv2-ogb-fixed-100k-v1@1b0e8fd579ab1cb86c02e833e7ad284b4af7582b059f912a77853fdccf3ede6d",
    "ema_semantics": "ema9999-each-step-selection",
    "evaluation_role_identity": "pcqm4mv2-ogb-fixed-100k-v1:internal-development-100000-150000",
    "lr_schedule_identity": "a4d40c75b727150bff6f1a581713dc306ac2491d175f5b54c04e3f5060cb415f",
    "matched_architecture_required": false,
    "optimizer_identity": "6122a1c768b0314d3ad4e69d40de3490279285b54aaa506b3e1041fe57847452",
    "precision_identity": "fp32-no-tf32-deterministic-bs128-drop-last",
    "row_split_identity": "train-0-100000-development-100000-150000@71d240a0a0d93054e9b47b9195d43914d3e6eadb66a4efc5346990db8c610818",
    "scientific_contract": "gptrans-v5-observation-reference-fp32-bs128-60epochs",
    "selection_role_identity": "pcqm4mv2-ogb-fixed-100k-v1:internal-development-100000-150000",
    "target_transform_identity": "472f746908b0f692e720a0b21faf3b8f5d48f90c9551dad11e2dd1db691a2285",
    "terminal_endpoint_identity": "46860-optimizer-steps",
    "x_axis_semantics": "optimizer_steps"
  },
  "comparison_role": "candidate",
  "contract_ref": "experiments/pcqm_gptrans_v5_audit_reference/contract.json",
  "evaluation_role_identity": "pcqm4mv2-ogb-fixed-100k-v1:internal-development-100000-150000",
  "exposure": {
    "optimizer_steps": 46860,
    "sample_presentations": 5998080
  },
  "metric_semantics": "internal_development_ema_gap_mae_eV",
  "model_identity": "04edcb6f928617d1142c624d071b7d7accb15c92d2f66e3473ed666ca7e5b2b2",
  "presentation_semantics_ref": "experiments/pcqm_gptrans_v5_audit_reference/contract.json",
  "reference_id": "pcqm-gptrans-v5-audit-reference-s42",
  "run_id": "gptrans-author-inputs-dual-s42:path_bond_mean",
  "schema": "molgap-trace-manifest-v1",
  "selection_semantics": "best_internal_development_ema_over_60_epochs",
  "terminal_evidence_ref": "experiments/pcqm_gptrans_author_alignment/gpu/path_bond_mean/results/terminal_evidence.json",
  "trace_artifact_ref": "platforms/_records/kaggle/training/gptrans_author_inputs_dual_s42_v1/gptrans_author_screen/path_bond_mean/training/canonical_trace.json",
  "trace_artifact_sha256": "63026afcc717920874bd05a7ea1662d07b2664c62df288d231e76a78f70d1f0b",
  "trace_fields": {
    "checkpoint_identity": true,
    "ema_dev_metric": true,
    "epoch_or_pass": true,
    "learning_rate": true,
    "live_dev_metric": true,
    "live_train_metric": true,
    "optimizer_step": true,
    "sample_presentations": true
  },
  "trajectory_id": "TC-gptrans-author-path-bond-mean-100k-s42",
  "weight_semantics": "ema",
  "x_axis": "optimizer_steps"
}
