{
  "backtest_eligibility": {
    "eligible": false,
    "exclusion_reasons": [
      "closure_synthesized_manifest_not_prelaunch_calibrated",
      "missing_frozen_reference"
    ]
  },
  "comparability_identity": {
    "architecture_identity": "unspecified_in_contract",
    "dataset_identity": "unspecified_in_contract",
    "ema_semantics": "unknown",
    "evaluation_role_identity": "internal_development",
    "lr_schedule_identity": "unspecified_in_contract",
    "matched_architecture_required": false,
    "optimizer_identity": "unspecified_in_contract",
    "precision_identity": "unspecified_in_contract",
    "row_split_identity": "unspecified_in_contract",
    "scientific_contract": "molgap-family-training-recipe-v1",
    "selection_role_identity": "best_development_metric",
    "target_transform_identity": "unspecified_in_contract",
    "terminal_endpoint_identity": "endpoint_234360",
    "x_axis_semantics": "optimizer_steps"
  },
  "comparison_role": "reference",
  "contract_ref": "experiments/pcqm_gptrans_bondlocal_pairnorm_lr_500k/generated/68756a96f1b29444e610ba40b14dd6f7006cae9b127a06e36f2a598147af6044/pairnorm_lr1e3/recipe.json",
  "evaluation_role_identity": "internal_development",
  "exposure": {
    "optimizer_steps": 234360,
    "sample_presentations": 29998080
  },
  "metric_semantics": "Gap MAE in eV",
  "model_identity": "unspecified_in_contract",
  "presentation_semantics_ref": "experiments/pcqm_gptrans_bondlocal_pairnorm_lr_500k/generated/68756a96f1b29444e610ba40b14dd6f7006cae9b127a06e36f2a598147af6044/pairnorm_lr1e3/recipe.json",
  "reference_id": "ev-terminal-T-pcqm-gptrans-pairnorm-lr-500k-s42-pairnorm_lr1e3",
  "run_id": "pcqm-gptrans-pairnorm-lr-500k-s42:pairnorm_lr1e3:downstream",
  "schema": "molgap-trace-manifest-v1",
  "selection_semantics": "best_development_metric",
  "terminal_evidence_ref": "experiments/pcqm_gptrans_bondlocal_pairnorm_lr_500k/runs/pcqm-gptrans-pairnorm-lr-500k-s42/prospective/pairnorm_lr1e3/terminal_staging/v1/79731fbade9a7986/terminal.json",
  "trace_artifact_ref": "external:///D:/molgap-artifacts/reconciliation/gptrans-bondlocal-pairnorm-lr-500k/v1/manifest/experiment/pairnorm_lr1e3/canonical_trace.json",
  "trace_artifact_sha256": "18a71afd7fcc6bcaf39fbc554a94a9ba4c62ed02e07700f3aabc6964fe9d4b34",
  "trace_fields": {
    "checkpoint_identity": true,
    "ema_dev_metric": true,
    "epoch_or_pass": true,
    "learning_rate": true,
    "live_dev_metric": false,
    "live_train_metric": true,
    "optimizer_step": true,
    "sample_presentations": true
  },
  "trajectory_id": "T-pcqm-gptrans-pairnorm-lr-500k-s42-pairnorm_lr1e3",
  "weight_semantics": "ema_and_live",
  "x_axis": "optimizer_steps"
}
