{
  "backtest_eligibility": {
    "eligible": true,
    "exclusion_reasons": []
  },
  "comparability_identity": {
    "architecture_identity": "0c62d8b26e0505b89906656c792a063d18d808b6698c3f5abcb17f35ac7121e9",
    "dataset_identity": "e0d4412326e631fba2d0d3ee74d93c8ba7c4acc5ef76be43d69ab24581bd159d",
    "ema_semantics": "ema-decay-0.9999",
    "evaluation_role_identity": "f44a677d54d7f99eacb610a481d2506f8d2bb1f66087cde8f88f7c90ff825d42",
    "lr_schedule_identity": "a4d40c75b727150bff6f1a581713dc306ac2491d175f5b54c04e3f5060cb415f",
    "matched_architecture_required": false,
    "optimizer_identity": "6122a1c768b0314d3ad4e69d40de3490279285b54aaa506b3e1041fe57847452",
    "precision_identity": "fp32:tf32-disabled:deterministic-algorithms:seed42",
    "row_split_identity": "71d240a0a0d93054e9b47b9195d43914d3e6eadb66a4efc5346990db8c610818",
    "scientific_contract": "ogb-lsc-pcqm4mv2-gap-internal-100k-v4:seed42:normalized-gap-l1",
    "selection_role_identity": "best-development-ema9999-60epochs",
    "target_transform_identity": "472f746908b0f692e720a0b21faf3b8f5d48f90c9551dad11e2dd1db691a2285",
    "terminal_endpoint_identity": "optimizer_steps46860:sample_presentations5998080",
    "x_axis_semantics": "optimizer_steps"
  },
  "comparison_role": "candidate",
  "contract_ref": "experiments/pcqm_gptrans_local_inductive_bias_100k_kaggle1/protocol.md",
  "evaluation_role_identity": "f44a677d54d7f99eacb610a481d2506f8d2bb1f66087cde8f88f7c90ff825d42",
  "exposure": {
    "optimizer_steps": 46860,
    "sample_presentations": 5998080
  },
  "metric_semantics": "Gap MAE in eV; live train/development and EMA development",
  "model_identity": "0c62d8b26e0505b89906656c792a063d18d808b6698c3f5abcb17f35ac7121e9",
  "presentation_semantics_ref": "experiments/pcqm_gptrans_local_inductive_bias_100k_kaggle1/training_contract_attempt_002.json",
  "reference_id": "pcqm-gptrans-local-bias-rwse16-100k-s42-a2",
  "run_id": "kaggle1-local-bias-rwse16-local-edge-100k-s42-v2",
  "schema": "molgap-trace-manifest-v1",
  "selection_semantics": "best-development-ema9999-60epochs",
  "terminal_evidence_ref": "pending",
  "trace_artifact_ref": "pending",
  "trace_fields": {
    "checkpoint_identity": true,
    "ema_dev_metric": true,
    "epoch_or_pass": true,
    "learning_rate": true,
    "live_dev_metric": true,
    "live_train_metric": true,
    "optimizer_step": true,
    "sample_presentations": true
  },
  "trajectory_id": "TB-gptrans-local-bias-rwse16-local-edge-100k-s42-a2",
  "weight_semantics": "ema-decay-0.9999",
  "x_axis": "optimizer_steps"
}
